{
  "candidate_id": "c09_value_open",
  "contract_id": "soft-procedure-contribution-loop-v1",
  "parent_ids": [
    "c08_release"
  ],
  "hypothesis": "低在制限制已显示减益；保留外部经济准入，取消全线令牌上限，恢复合批和设备供料空间。",
  "mechanism": "refinement",
  "interfaces": [
    "dispatch",
    "admission",
    "release",
    "defer"
  ],
  "parameters": {
    "dispatch": "family",
    "admission": "value"
  },
  "bundle_sha256": "1cd3355a421013fd4735956acc8e709956b45d04f7961bd0195ebae157c4906f",
  "interface_version": "seccomp-json-v1",
  "training_provenance": "deterministic analytical rules; no external training data",
  "randomization_rule": "deterministic; candidate has no environment seed access",
  "expected_tradeoffs": "可能有较多在制积压，保留全量披露。"
}
