{
  "candidate_id": "c24_ablate_m4",
  "contract_id": "soft-procedure-contribution-loop-v1",
  "parent_ids": [
    "c20_hybrid"
  ],
  "hypothesis": "只移除M4合批覆盖，识别M4对高价P4与其他产品的排序贡献。",
  "mechanism": "ablation",
  "interfaces": [
    "dispatch",
    "admission",
    "release",
    "defer"
  ],
  "parameters": {
    "dispatch": "margin",
    "admission": "value",
    "station_modes": {
      "M2": "family",
      "M3": "family"
    }
  },
  "bundle_sha256": "9d47e85a2e623775cfdb67ef09d21ad91e88a07bb34ad4e791768f6d67391567",
  "interface_version": "seccomp-json-v1",
  "training_provenance": "deterministic analytical rules; no external training data",
  "randomization_rule": "deterministic; candidate has no environment seed access",
  "expected_tradeoffs": "可能增加M4切换或改变P4产量。"
}
